ID,link,text,user,likes,comments,retweets,external-link,quotes
228,https://twitter.com/elonmusk/status/1755498004985868454#m,"But wait, there’s more!",Elon Musk,20026,1384,3534,,96
229,https://twitter.com/elonmusk/status/1755497805337026919#m,"Here is the full racist, sexist, etc discriminatory set of laws enforced by Disney’s DEI Gestapo:",Elon Musk,9997,425,2611,,110
230,https://twitter.com/NASAKennedy/status/1755468404050255981#m,"Live launch coverage from Space Launch Complex 40!  Join us as we are #KeepingPACE with the launch of @NASA’s newest Earth observation mission, PACE!  Have a question about the mission? Use #AskNASA!  https://nitter.no-logs.com/i/broadcasts/1gqGvQMqNXjKB",NASA's Kennedy Space Center,5701,491,998,,47
231,https://twitter.com/SpaceX/status/1755453405521494164#m,Less than two hours until Falcon 9’s launch of @NASA’s PACE mission from pad 40 in Florida. All systems are looking good and weather is 95% favorable for liftoff,SpaceX,14766,999,1853,,75
232,https://twitter.com/elonmusk/status/1755417748602229001#m,Good advice for how best use 𝕏,Elon Musk,33919,2350,5031,,164
233,https://twitter.com/MKBHD/status/1753228338456363279#m,"After a week, I am very very impressed with the new Tesla Model 3 refresh. Tons of small updates and refinements add up to the easiest to recommend electric car in the world right now.  Full video: https://invidious.no-logs.com/iueGI4CzP-0",Marques Brownlee,26462,1729,2203,,167
234,https://twitter.com/SpaceX/status/1755235332243837142#m,Dragon separation confirmed!,SpaceX,23587,835,2612,,146
235,https://twitter.com/SpaceX/status/1755232300860870789#m,Dragon is GO to undock from the @space_station,SpaceX,11460,425,1339,,37
236,https://twitter.com/cb_doge/status/1755351510517457060#m,BREAKING: 𝕏 is now the #1 News App in record 163 countries around the world. (AppStore),DogeDesigner,14695,897,2341,,191
237,https://twitter.com/elonmusk/status/1755290360702734431#m,Disney sucks,Elon Musk,542008,37777,61203,,5296
238,https://twitter.com/Tesla/status/1755168433866412260#m,Track Mode on a frozen lake in 🇳🇴,Tesla,22340,1357,2896,,313
239,https://twitter.com/XFashion/status/1755229949617656124#m,"❤️ this post for your 𝕏 Fashion invite to watch Womenswear Fashion Weeks in New York, London, Milan and Paris.",Fashion,13543,1076,1583,,142
240,https://twitter.com/elonmusk/status/1755266935703617613#m,The likely future leader of South Africa calls for genocide of the 4 million whites who live there,Elon Musk,202790,26859,61173,,6080
241,https://twitter.com/elonmusk/status/1755264717365669933#m,Yup,Elon Musk,570244,12656,42442,,2803
242,https://twitter.com/elonmusk/status/1755264018145804689#m,"If I had a dollar for every time the media reported that one of my companies was going to die, I would never need to raise money!",Elon Musk,209011,7590,18579,,868
243,https://twitter.com/elonmusk/status/1755263367345033712#m,It’s almost as though you can’t trust the media 🤔,Elon Musk,153483,7301,27221,,887
244,https://twitter.com/elonmusk/status/1755263112834675025#m,Ice cream is amazing,Elon Musk,228462,8536,23656,,2097
245,https://twitter.com/elonmusk/status/1755262588483698957#m,Illegal voter importation,Elon Musk,63999,3304,14441,,374
246,https://twitter.com/elonmusk/status/1755261899187630343#m,"Live by the ⚔️ , die by the ⚔️",Elon Musk,30550,2652,5428,,234
247,https://twitter.com/SpeakerJohnson/status/1755231996513567021#m,"Another 1 million encounters at the southern border since the start of the fiscal year. This is a new record, and the earliest we’ve hit this terrible threshold. Under President Biden, the catastrophe he created grows worse, and the danger and chaos at the border continues to harm America.  He must immediately use his executive authority to take action now.  https://www.foxnews.com/politics/cbp-migrant-encounters-exceed-1-million-october",Speaker Mike Johnson,24900,12735,5775,,833
248,https://twitter.com/eyeslasho/status/1755256604587655516#m,"Life under the iron fist of The Patriarchy: Women in the US outpace men in AP course completion and college degrees (including PhDs), while men outpace women in deaths on the job, incarceration, drug addiction and homelessness.",i/o,8083,648,1742,,135
249,https://twitter.com/elonmusk/status/1755254865759293561#m,𝕏 is now the #1 most downloaded app of any kind!,Elon Musk,147724,10397,13888,,1338
250,https://twitter.com/elonmusk/status/1755254449285820764#m,"If true, this would be disturbing indeed.   One may agree with Tucker or not, but he is a major American journalist and such an action would greatly offend the American public.",Elon Musk,224189,25611,42951,,2769
251,https://twitter.com/WholeMarsBlog/status/1755148246539002048#m,"Congratulations X team and @elonmusk   X is the number 1 free app in the App Store right now, beating out ChatGPT, Threads and TikTok    Tell your friends to sign up for X and let’s keep it going",Whole Mars Catalog,11824,1210,1477,,122
252,https://twitter.com/elonmusk/status/1755140161430852000#m,Insane,Elon Musk,43962,3429,7118,,256
253,https://twitter.com/XData/status/1754856866121699794#m,The #Grammys stole the show on X this weekend with 18.5 million total posts (+54% more than last year) and 3.3 million unique people posting (+57%).,Data,5987,465,672,,41
254,https://twitter.com/elonmusk/status/1755133632669479058#m,Shocker …,Elon Musk,131988,6221,37579,,1190
255,https://twitter.com/elonmusk/status/1755128368834683077#m,Another show coming to 𝕏!,Elon Musk,76908,3050,9703,,250
256,https://twitter.com/jimrome/status/1754971654533623929#m,The Jungle is coming to @X!,Jim Rome,9816,677,1056,,104
257,https://twitter.com/elonmusk/status/1755007753289134162#m,"If you were discriminated against by Disney or its subsidiaries (ABC, ESPN, Marvel, etc), just reply to this post to receive legal support",Elon Musk,160188,9354,38251,,1782
258,https://twitter.com/elonmusk/status/1754999578619707658#m,"An anonymous source just sent me this from Disney. It is mandatory, institutionalized racism and sexism!",Elon Musk,226530,19124,55527,,5203
259,https://twitter.com/cb_doge/status/1754980769871626342#m,"""𝕏 is the only platform you can trust for honest information.   All the others are bought and paid for.""",DogeDesigner,11678,1284,1555,,115
260,https://twitter.com/elonmusk/status/1754980027249095090#m,"If evil people are given a moral cloak that cannot be questioned, they are certain to wear it.  This is not to say that all transgender people are bad – that would be false – but rather that they should be no more above questioning than anyone else.",Elon Musk,98126,5436,21098,,769
261,https://twitter.com/elonmusk/status/1754969570744336741#m,Strange Dayz,Elon Musk,256061,12297,42155,,1770
262,https://twitter.com/elonmusk/status/1754968330916528468#m,You are being gaslit,Elon Musk,393311,33418,81945,,4933
263,https://twitter.com/elonmusk/status/1754956541252263941#m,Please let us know if you would like to join the lawsuit against Disney,Elon Musk,175184,9769,24604,,1175
264,https://twitter.com/elonmusk/status/1754953564173042041#m,,Elon Musk,454655,21382,86637,,6571
265,https://twitter.com/Not_the_Bee/status/1754916614133449114#m,The NYT published this opinion piece and hoo boy were some of their readers mad https://notthebee.com/article/nyt-opinion-hey-maybe-letting-kids-inalterably-mutilate-their-bodies-isnt-such-a-great-idea-after-all https://notthebee.com/article/nyt-opinion-hey-maybe-letting-kids-inalterably-mutilate-their-bodies-isnt-such-a-great-idea-after-all,Not the Bee,7688,563,1453,,57
266,https://twitter.com/Starlink/status/1754913980215394785#m,"Starlink is connecting communities all across the Caribbean, including on the island of Barbados → stories.starlink.com/stories…  High-speed internet from space almost anywhere on Earth 🛰️🌎❤️",Starlink,8043,743,1090,,64
267,https://twitter.com/elonmusk/status/1754927324238340151#m,👀,Elon Musk,392640,10919,26056,,1395
268,https://twitter.com/elonmusk/status/1754923423019761680#m,LGBTQ(Anon?),Elon Musk,63343,9266,5756,,1517
269,https://twitter.com/EndWokeness/status/1754917621324017736#m,"BREAKING: 8 of the 8 known suspects in the NYPD-beating are illegal aliens who were let in by Biden in 2023:  7 of them are from Venezuela, 1 of them is from Ecuador.   6 invaded through Texas and the other 2 crossed the *Northern* border through Canada. All in the past few months.  Source: @AliBradleyTV, NewsNation",End Wokeness,29001,1394,8045,,377
270,https://twitter.com/ptraughber/status/1754918478400848375#m,"If you haven't yet subscribed to Premium, subscribe today and try it out. We've added a lot of new features in the last few months, with more coming soon. Let me know how you like it, and what other features you'd like to see (reply here or DM me!).",Patrick Traughber,3377,944,465,,32
271,https://twitter.com/TomFitton/status/1754511968927461771#m,"Fact check: @ElonMusk is correct. 24 states and DC have enacted or enabled automatic voter registration at DMVs and other gov't agencies. Such programs can result in dirty voting rolls, such as potentially increasing duplicate voter registrations. In addition, the ""Government"" should not be in the business of telling individuals to register to vote. Ballot harvesting is a menace to clean elections by making it easy to commit voter fraud and intimidation.",Tom Fitton,27336,1043,10724,,344
272,https://twitter.com/elonmusk/status/1754693877758587269#m,,Elon Musk,143612,11259,15798,,2048
273,https://twitter.com/elonmusk/status/1754691533931168038#m,,Elon Musk,89546,6592,27779,,2320
274,https://twitter.com/robbystarbuck/status/1754646356604395557#m,Yaeli had depression in 8th grade.  Her mom Abigail took her to get help.  Yaeli was convinced by doctors & school that she was trans.  Her mom refused to transition her so CPS took her. California transitioned Yaeli and she committed suicide.  Full film: TheWarOnChildren.com,Robby Starbuck,20287,1580,7925,,764
275,https://twitter.com/JDVance1/status/1754550708756426896#m,Granting Mayorkas the ability to grant asylum claims without going through immigration court is perhaps the worst provision of the bill.,J.D. Vance,20998,1614,4604,,201
276,https://twitter.com/elonmusk/status/1754646345393352933#m,"Exactly.   Rather than secure the borders, this administration and many states are rolling out the red carpet!  https://nypost.com/2024/02/02/metro/nyc-to-hand-out-prepaid-credit-cards-to-migrant-families-for-food/amp/",Elon Musk,117116,6736,27198,,794
277,https://twitter.com/cb_doge/status/1754606263017636240#m,𝕏 - 112.9 billion visits in 2023 Instagram - 87.3 billion visits in 2023 TikTok - 41.8 billion visits in 2023,DogeDesigner,15024,1402,1930,,199
278,https://twitter.com/elonmusk/status/1754605724754186318#m,Absolutely true,Elon Musk,171677,8137,39786,,1100
279,https://twitter.com/elonmusk/status/1754549207338242289#m,This is cool,Elon Musk,80748,4561,11001,,358
280,https://twitter.com/elonmusk/status/1754548634614390906#m,,Elon Musk,92563,6563,27655,,2289
281,https://twitter.com/cb_doge/status/1754544171699069111#m,3 quick ways to grow your community on 𝕏:  - Spotlight your community on your profile. - Improve discoverability by updating search tags. - Community list to enhance content.  via @DongWookChung2,DogeDesigner,3681,618,677,,18
282,https://twitter.com/elonmusk/status/1754480700122665034#m,NGO personnel who deliberately and repeatedly broke the law to facilitate illegal immigration should face prosecution immediately!,Elon Musk,134592,8315,40636,,1713
283,https://twitter.com/elonmusk/status/1754388953275240743#m,Well-summarized,Elon Musk,59335,3491,16084,,467
284,https://twitter.com/CathieDWood/status/1754351091519500697#m,"The Delaware plaintiff lawyers did come after us, but brilliant attorney, Jane Kanter, had prepared us, so the big dogs walked away. I have asked my legal team to extract us from Delaware, once was a beacon for entrepreneurs and investors in the US, but now a menace.",Cathie Wood,11436,625,1614,,85
285,https://twitter.com/CathieDWood/status/1754347416768200794#m,"In its ruling against @elonmusk's pay-for-performance compensation package, Delaware seems to question whether it was fair to all shareholders. Given the results five years later, with $TSLA up ~13-fold from the time of the vote to its peak in November 2021 and still up 9-fold today, I would like to understand what Delaware means by ""fairness"".  https://www.cnbc.com/2018/02/07/ark-chief-catherine-wood-sees-tesla-stock-going-to-4000.html",Cathie Wood,11213,640,1463,,62
286,https://twitter.com/elonmusk/status/1754382852840399335#m,,Elon Musk,147245,8248,26960,,2095
287,https://twitter.com/elonmusk/status/1754382187963506924#m,The long-term goal of the so-called “Border Security” bill is enabling illegals to vote!  It will do the total opposite of securing the border.,Elon Musk,144573,7907,37951,,1523
288,https://twitter.com/elonmusk/status/1754380862521569564#m,Thank you,Elon Musk,76104,4348,8991,,231
289,https://twitter.com/elonmusk/status/1754306194829881652#m,Good progress!,Elon Musk,100559,5038,15696,,533
290,https://twitter.com/elonmusk/status/1754198561674363080#m,Critical thinking should be the first thing taught to kids,Elon Musk,237983,14059,43142,,2572
291,https://twitter.com/elonmusk/status/1754067365707563045#m,Should I make the Texas Institute of Technology & Science real?  It would of course have Advanced Social Studies too.,Elon Musk,261641,28087,24097,,3047
292,https://twitter.com/elonmusk/status/1754060546570432790#m,Bill Maher is absolutely right,Elon Musk,130609,4489,28161,,715
293,https://twitter.com/nypost/status/1753941158244290898#m,Far-left comic Michael Rapaport says voting for Trump is ‘on the table’ after seeing migrants beat down cops in Times Square https://trib.al/jmwrLgI,New York Post,25581,3229,3509,,1520
294,https://twitter.com/imPenny2x/status/1753482478600556659#m,"Here is the video recording of my live 𝕏 spaces conversation with Jared Issacman (@rookisaacman), a billionaire business man, stunt pilot, and SpaceX mission commander.   This is my first video podcast. We discussed the space race with China, Starship, entrepreneurship, philanthropy, and his best advice if your kid want's to be an astronaut.  Timestamps:  1:22 - What was it like to be little Jared 7:53 - ""Ghost Squadron"" air show team 10:14 - Raising money for St. Jude 16:36 - Fly on the wall at SpaceX 18:33 - Being unselfish 21:30 - Polaris program and Starship 27:51 - Risk vs reward riding rockets 33:50 - Repairing Hubble and commercial space 40:50 - The Space race and SpaceX 45:00 - Landing on Mars and the Moon 50:15 - AI and Robotics (Optimus) 54:12 - How to become an astronaut 57:30 - Listener questions  Kindly repost, and comment with feedback. <3",Penny2x,4945,451,893,,59
295,https://twitter.com/elonmusk/status/1754053261190181003#m,It was always the plan,Elon Musk,101240,7514,25742,,1065
296,https://twitter.com/cb_doge/status/1753913972737417559#m,,DogeDesigner,28584,1730,4356,,330
297,https://twitter.com/elonmusk/status/1753894223831793844#m,"If you’re wondering why housing is so expensive, this is a major contributor",Elon Musk,78142,3960,10105,,617
298,https://twitter.com/elonmusk/status/1753894000510341530#m,"A few other things you probably don’t know: illegals in America can get bank loans, mortgages, insurance, driver’s licenses, free healthcare (California & New York) and in-state college tuition.  What’s the point of being a citizen if an illegal gets all the benefits, but doesn’t pay taxes or do jury duty?",Elon Musk,263106,28533,70051,,5948
299,https://twitter.com/elonmusk/status/1753853879282753981#m,Impeach @SecMayorkas for deliberately breaking the law and massively increasing illegal immigration beyond all historical precedent,Elon Musk,49861,8302,18798,,1212
300,https://twitter.com/elonmusk/status/1753852898323132686#m,"In the “bet-you-didn’t-know” category, Homeland Security Secretary Mayorkas issued written guidance making it clear that:  1. Illegal presence alone is not grounds for deportation.  2. Criminal charges, convictions or gang membership alone are not enough for deportation.  You basically have to be a convicted axe murderer to be deported!  That’s because every deportation is a lost vote.",Elon Musk,206386,23995,57880,,3650
301,https://twitter.com/elonmusk/status/1753847055749959765#m,"As a reminder, I am very much PRO increasing legal immigration significantly.   I’m not anti-immigration, I’m just against a massive number of unvetted people flooding into America, which any rational person should be.",Elon Musk,309842,19314,41198,,3728
302,https://twitter.com/elonmusk/status/1753843000592015492#m,"As a general rule, if you believe *everything* your political party says, you are an idiot",Elon Musk,362015,19623,64327,,8628
303,https://twitter.com/elonmusk/status/1753839283125862782#m,"We should not, for example, impose draconian laws on farmers or make citizens uncomfortable by limiting air-conditioner usage!  Keep tax revenue constant, but shift it to  tax what is probably bad (CO2), just like alcohol & cigarettes are taxed more than fruits & vegetables.",Elon Musk,14905,5443,1832,,552
304,https://twitter.com/elonmusk/status/1753837756793466975#m,The only action needed to solve climate change is is a carbon tax,Elon Musk,40050,28838,7422,,5706
305,https://twitter.com/elonmusk/status/1753813669945774393#m,Most people in America don’t know that the census is based on a simple headcount of people (including illegals) *not* just citizens.    This shifts political power and money to states and Congressional districts with the highest number of illegals.,Elon Musk,172486,15002,41432,,2814
306,https://twitter.com/theallinpod/status/1753517824771817780#m,"E164 live on @X !  (0:00) bestie intros! the guys try the apple vision pro  (8:24) zuck apologizes to parents in hearing, section 230 under fire from child safety reforms  (36:19) delaware judge voids @elonmusk's comp package, understanding fortune 500 ""country club compensation""  (1:08:26) @reddit reportedly targeting $5b valuation in potential march ipo  (1:16:17) drone attack, risks of greater middle east conflict, failures of the military industrial complex",The All-In Podcast,5771,707,981,,88
307,https://twitter.com/elonmusk/status/1753603987234812367#m,,Elon Musk,18287,2100,2895,,237
308,https://twitter.com/elonmusk/status/1753596522611011864#m,"This explains why there are so few deportations, as every deportation is a lost vote.  As happened this week, you can literally assault police officers in broad daylight in New York, be released with no bail, give everyone the finger and *still* not be deported!!  Outrageous.",Elon Musk,172178,16538,48838,,3049
309,https://twitter.com/elonmusk/status/1753592431428186292#m,"Here is the full text of the bill. It sounds so reasonable at first, just like “The Committee of Public Safety” actually meant “The Cutting Off Heads Committee” in revolutionary France. https://www.congress.gov/117/bills/hr1177/BILLS-117hr1177ih.pdf",Elon Musk,38560,1527,7459,,239
310,https://twitter.com/elonmusk/status/1753590787130994745#m,"Biden’s strategy is very simple:  1. Get as many illegals in the country as possible.  2. Legalize them to create a permanent majority – a one-party state.  That is why they are encouraging so much illegal immigration. Simple, yet effective.",Elon Musk,262571,30729,67803,,8637
311,https://twitter.com/elonmusk/status/1753558414028845502#m,This is insane,Elon Musk,103935,7000,17604,,617
312,https://twitter.com/SpaceX/status/1753492142201475570#m,"Super Heavy boosters for the next three flights, with a fourth ready to stack, in the Starbase Megabay",SpaceX,31571,1757,4289,,495
313,https://twitter.com/cb_doge/status/1753456917010141661#m,"Birth rate collapse is the biggest threat to human civilization.  • South Korea has the world’s lowest birth rate and it has become a national emergency. • China's population drops for second year, with record low birth rate • U.S. birth rate declined 30% in 15 years • Canada's fertility rate lowest on record • France’s birth rates are the lowest since 1946 • Ukraine, Romania, Belarus and Moldova are among the top 10 countries in the world with the biggest population decline. • Japan is also staring at a population crisis. Its birth rate declined for the seventh consecutive year.",DogeDesigner,8946,2436,2212,,389
314,https://twitter.com/elonmusk/status/1753457357466607771#m,Wow,Elon Musk,113063,7103,27738,,908
315,https://twitter.com/TeslaAUNZ/status/1753219282140606699#m,Your Tesla tells you when & where to charge—even on the biggest road trip,Tesla Australia & New Zealand,8119,754,1158,,73
316,https://twitter.com/elonmusk/status/1753371933977018703#m,Review of new Model 3 by @MKBHD,Elon Musk,36658,2583,3650,,130
317,https://twitter.com/XBusiness/status/1753072412969799897#m,The Super Bowl is going to be bigger than ever this year on X. This year's NFL Conference Championships were the most talked about since 2019 according to conversation on X.   Connect with NFL fans during the Big Game. Start a new campaign: https://ads.x.com/login,Business,6570,775,960,,57
318,https://twitter.com/elonmusk/status/1753275709408080364#m,Dr. Drew gets it,Elon Musk,76592,4054,16412,,575
319,https://twitter.com/SpaceX/status/1753151972503629865#m,"SpaceX is working with researchers to develop and fly critical science on Dragon, helping to advance humanity’s ability to live and work in space → spacex.com/humanspaceflight/…",SpaceX,17684,998,2384,,177
320,https://twitter.com/elonmusk/status/1753269554816372839#m,"When you hear the names of legislation or anything done by the government, it is worth remembering that the group that sent so many people to the guillotine during the French Revolution was called “The Committee of Public Safety”, not the “Cut Off Their Heads Committee” https://www.britannica.com/topic/Committee-of-Public-Safety",Elon Musk,242983,11963,54492,,2908
321,https://twitter.com/elonmusk/status/1753203811684880714#m,Worth reading,Elon Musk,109939,6404,29189,,940
322,https://twitter.com/elonmusk/status/1753198634005344378#m,"Not only were they not deported, they were given a free ticket to California! https://x.com/CollinRugg/status/1753186988289937472?s=20",Elon Musk,81446,5445,18384,,675
323,https://twitter.com/elonmusk/status/1753193317687308342#m,This could have been your family. It was someone’s family.,Elon Musk,89013,3710,13741,,388
324,https://twitter.com/elonmusk/status/1753191879779181057#m,It is hard to visualize the consequences of bad lawmakers until you see the victims,Elon Musk,134202,5714,31152,,1056
325,https://twitter.com/libsoftiktok/status/1753165222754529375#m,"One of these people is in our county illegally, beat up cops, and was released without bail.  The other is a former Marine who protected riders on a subway from a violent psycho, is facing criminal charges, and was released on a $100,000 bail.  Democrats’ soft-on-violent crime and no bail policies in action.",Libs of TikTok,107994,3735,33931,,1942
326,https://twitter.com/elonmusk/status/1753129493177188380#m,The craziness continues!,Elon Musk,98261,5458,21537,,703
327,https://twitter.com/elonmusk/status/1753128820603834776#m,420M mobile search results 😂,Elon Musk,67492,4788,9270,,341
328,https://twitter.com/elonmusk/status/1753125929147080766#m,What the heck is going on!?,Elon Musk,295577,34389,64703,,4031
329,https://twitter.com/elonmusk/status/1753125299548471615#m,Outrageous!,Elon Musk,199711,14630,46169,,2477
330,https://twitter.com/elonmusk/status/1753123726554517611#m,Change your state of incorporation out of Delaware before they lock the doors.   They are currently blocking John Malone from changing incorporation from Delaware to Nevada.,Elon Musk,98820,4847,16967,,715
331,https://twitter.com/Jason/status/1753073747656130832#m,My firm invests in 100+ new tech startups a year & like everyone we standardized on Delaware C corps because our lawyers told us it was the most just & trustworthy jurisdiction  Given the corruption in Delaware we will be changing this immediately.  #standwithelon,@jason,16139,952,2134,,144
332,https://twitter.com/elonmusk/status/1753056577395798453#m,!!,Elon Musk,198668,11178,58932,,1939
333,https://twitter.com/elonmusk/status/1752976312623312932#m,Interesting,Elon Musk,101428,8538,21969,,948
334,https://twitter.com/elonmusk/status/1752936489279701249#m,…,Elon Musk,55276,4874,7144,,264
335,https://twitter.com/elonmusk/status/1752922071229722990#m,The public vote is unequivocally in favor of Texas!  Tesla will move immediately to hold a shareholder vote to transfer state of incorporation to Texas.,Elon Musk,223859,11257,26622,,1844
336,https://twitter.com/Starlink/status/1752746707652141078#m,"Stay connected with high-speed internet at home or on the go. Streaming, video calls, online gaming and more are now possible even in the most remote locations on Earth → starlink.com",Starlink,11530,1077,1791,,93
337,https://twitter.com/cb_doge/status/1752861069255823692#m,𝕏 has 90 million US users. 🇺🇸,DogeDesigner,16034,1499,1890,,147
338,https://twitter.com/lindayaX/status/1752799860091175383#m,"To the parents, families, and young people who attended today's Child Safety Hearing thank you for your unimaginable courage. You have my personal commitment that @X will be a partner in making the internet safer. Our conviction is shared, our commitment is real. It’s time to ACT. https://blog.twitter.com/en_us/topics/company/2023/an-update-on-our-work-to-tackle-child-sexual-exploitation-on-x",Linda Yaccarino,15670,1552,2032,,187
