ID,link,text,user,likes,comments,retweets,external-link,quotes
339,https://twitter.com/SpaceX/status/1752700978686742984#m,"Starship will fundamentally change how we access space, with entire space stations like Starlab launched on a single mission",SpaceX,17495,1509,2283,,125
340,https://twitter.com/elonmusk/status/1752710765847744859#m,What has become of America?,Elon Musk,217914,30062,47900,,2980
341,https://twitter.com/elonmusk/status/1752539100320788569#m,,Elon Musk,50912,5348,7456,,359
342,https://twitter.com/elonmusk/status/1752516361799258318#m,Going for a walk with Optimus,Elon Musk,261927,25236,30933,,5307
343,https://twitter.com/elonmusk/status/1752500143138762791#m,Illegal immigration has increased by almost 1000% over the past decade and is still rising rapidly,Elon Musk,135376,9442,26902,,1169
344,https://twitter.com/elonmusk/status/1752499575464902998#m,The United States is being overwhelmed,Elon Musk,135823,9736,38225,,1840
345,https://twitter.com/elonmusk/status/1752491924848820595#m,"Should Tesla change its state of incorporation to Texas, home of its physical headquarters?",Elon Musk,52603,17741,9704,,1462
346,https://twitter.com/elonmusk/status/1752486201083543842#m,I recommend incorporating in Nevada or Texas if you prefer shareholders to decide matters,Elon Musk,113782,5902,10698,,628
347,https://twitter.com/elonmusk/status/1752455348106166598#m,Never incorporate your company in the state of Delaware,Elon Musk,170052,14142,16247,,2754
348,https://twitter.com/cb_doge/status/1752441095982862463#m,𝕏 Community Admins can now increase their visibility in recommendations and search by using search tags.,DogeDesigner,4598,629,799,,28
349,https://twitter.com/elonmusk/status/1752425853210759540#m,"If Denver is having trouble with 40,000 illegals, how will they handle the next 400,000?   The illegal influx is growing exponentially and just exceeded babies born in America last month!",Elon Musk,133408,10217,38304,,1748
350,https://twitter.com/elonmusk/status/1752398611453796794#m,Congrats to the @SpaceX team for the first time completing 10 rocket launches & landings in a single month!,Elon Musk,90226,4695,11444,,501
351,https://twitter.com/elonmusk/status/1752321936368017524#m,Some Like It Cold!: the musical The perfect temp is:,Elon Musk,12743,6993,2733,,321
352,https://twitter.com/SawyerMerritt/status/1752146284419461572#m,"In 2023, Tesla's sales of the Model Y in California surpassed the combined sales of Toyota's RAV4 and Honda's CR-V in the state.",Sawyer Merritt,10780,1256,1440,,95
353,https://twitter.com/elonmusk/status/1752202880738845094#m,And the quality looks like you’re a child,Elon Musk,395834,10825,27770,,1726
354,https://twitter.com/SawyerMerritt/status/1752199525068845493#m,"BREAKING: For the first time ever, the @Tesla Model Y was officially the best-selling car overall in the world in 2023, with 1.23 million units sold. This is the first time an EV took the #1 spot in global sales.  What's crazy is that Model Y production started only 4 years ago.  Note: While others have already claimed the Model Y was the best-selling car in the world in 2023, tonight we received Toyota's official 2023 sales data to support the claim, which is why I waited to report the news until now.",Sawyer Merritt,21469,1193,3130,,278
355,https://twitter.com/elonmusk/status/1752119586470949056#m,"Enables control of your phone or computer, and through them almost any device, just by thinking.  Initial users will be those who have lost the use of their limbs.   Imagine if Stephen Hawking could communicate faster than a speed typist or auctioneer. That is the goal.",Elon Musk,36588,5875,4521,,1681
356,https://twitter.com/elonmusk/status/1752118131579867417#m,The first @Neuralink product is called Telepathy,Elon Musk,93864,9339,10324,,2933
357,https://twitter.com/elonmusk/status/1752098683024220632#m,The first human received an implant from @Neuralink yesterday and is recovering well.  Initial results show promising neuron spike detection.,Elon Musk,239500,25780,33006,,14766
358,https://twitter.com/elonmusk/status/1752061034272301284#m,Exactly,Elon Musk,82569,3139,14521,,275
359,https://twitter.com/elonmusk/status/1752060088913661966#m,Was having dinner with some friends and they said all their family in Europe totally believes the news 🤣🤣,Elon Musk,159998,17154,16364,,1941
360,https://twitter.com/elonmusk/status/1752059651116405200#m,Spicing these memes up with a little Herzog https://invidious.no-logs.com/watch?v=QhMo4WlBmGM,Elon Musk,4132,590,724,,45
361,https://twitter.com/elonmusk/status/1752045709258375260#m,"One day, the chickens may turn on us …",Elon Musk,193658,9755,18885,,1666
362,https://twitter.com/elonmusk/status/1752033682528018768#m,"Legacy media controlling what subjects they write about is by far their biggest lie, as they can ignore important matters and inflate minor ones.   𝕏 enables the people to define the narrative.",Elon Musk,193981,14801,35430,,2331
363,https://twitter.com/elonmusk/status/1752012312981000683#m,It is usually safe to assume that any proposed law will do the opposite of its name – “Orwell’s Law”,Elon Musk,64817,4254,17906,,506
364,https://twitter.com/SpaceX/status/1751867969192509874#m,"Falcon 9 completes two launches within four hours from Florida and California, delivering 45 @Starlink satellites to orbit",SpaceX,18287,1603,2573,,182
365,https://twitter.com/elonmusk/status/1751860429465239697#m,You rang!?,Elon Musk,106907,7909,10700,,674
366,https://twitter.com/SpaceX/status/1751847372689490183#m,A flash of color and liftoff of Falcon 9!,SpaceX,17063,1284,2078,,148
367,https://twitter.com/SpaceX/status/1751849478926291136#m,"Falcon 9 first stage landing on the Of Course I Still Love You droneship, completing this booster's ninth mission",SpaceX,15492,1016,1890,,158
368,https://twitter.com/elonmusk/status/1751796560357097692#m,Aiming for 2 launches of Starlink tonight,Elon Musk,50735,4442,6189,,257
369,https://twitter.com/elonmusk/status/1751718413435855115#m,I guess this one is not a banger,Elon Musk,5812,1330,641,,53
370,https://twitter.com/elonmusk/status/1751651587267952884#m,"Colon Cologne, but it is the best fragrance at masking odors originating from said organ",Elon Musk,50561,8130,7199,,582
371,https://twitter.com/elonmusk/status/1751493496941261146#m,Inner demons can be helpful,Elon Musk,475136,17377,46913,,3041
372,https://twitter.com/elonmusk/status/1751486972336492974#m,"“Colon Cologne, the fragrance that takes you beyond Uranus!” – Grok",Elon Musk,63610,6950,6556,,792
373,https://twitter.com/cb_doge/status/1751235710323921115#m,"Everyone can be a citizen journalist.  You just need a mobile, internet connectivity and 𝕏 app.",DogeDesigner,14039,2388,2419,,240
374,https://twitter.com/elonmusk/status/1751165819919233410#m,That is undeniable at this point,Elon Musk,362900,25658,79235,,3394
375,https://twitter.com/elonmusk/status/1750995501560807465#m,xAI is not raising capital and I have had no conversations with anyone in this regard,Elon Musk,70204,6987,11325,,531
376,https://twitter.com/EvasTeslaSPlaid/status/1750843655634530477#m,"PepsiCo says its Tesla Semi surpassed 1,000 miles in single-day haul. 🔥 @Tesla @elonmusk",Eva McMillan ♥️,16800,1708,2112,,143
377,https://twitter.com/elonmusk/status/1750965742021841250#m,Extremely concerning,Elon Musk,107384,6603,22705,,679
378,https://twitter.com/SawyerMerritt/status/1750542026888646964#m,"Pepsi in new CNN video: “These (Tesla Semi) trucks can run up to 500 miles on a single charge in a single day, so between two drivers one truck and 24 hours, we were able to run 1,076 on a single electric truck.”",Sawyer Merritt,20062,2413,3021,,263
379,https://twitter.com/XBusiness/status/1750242718234681814#m,Don’t sleep on connecting with your customers on X!  @EightSleep increased their revenue generated by X Ads by +102% in just one month with the help of an X Ads Specialist. Book a meeting to maximize your ROI today → bit.ly/3Hli4zV,Business,7007,1734,1315,,86
380,https://twitter.com/XData/status/1750280284635824485#m,"Conversation about this year’s Oscar nominees is surging on X, with +120% more posts and +326% more video views than last year. There have already been over 1.2 billion impressions on Oscars content so far this year.",Data,8536,1603,1233,,91
381,https://twitter.com/elonmusk/status/1750408774773588440#m,Worth it,Elon Musk,27157,5311,4541,,221
382,https://twitter.com/elonmusk/status/1750377366088798237#m,This is my concern re Tesla voting control. Money doesn’t matter if powerful technology goes awry.,Elon Musk,36363,6309,6152,,295
383,https://twitter.com/elonmusk/status/1750376543078232169#m,Saw the Barbie movie recently,Elon Musk,109626,7954,11717,,797
384,https://twitter.com/elonmusk/status/1750368096945070474#m,And he did,Elon Musk,282095,12043,22332,,1379
385,https://twitter.com/elonmusk/status/1750365222819233947#m,It will be,Elon Musk,105209,9368,15571,,1737
386,https://twitter.com/elonmusk/status/1750358106536902830#m,Interview with @BenShapiro,Elon Musk,90138,8880,16020,,769
387,https://twitter.com/elonmusk/status/1750191713434619989#m,,Elon Musk,85060,9731,14495,,915
388,https://twitter.com/SpaceX/status/1749997767156806104#m,Falcon 9 launches 22 @Starlink satellites to orbit from California,SpaceX,22338,2110,2866,,184
389,https://twitter.com/SpaceX/status/1749956182259953908#m,Falcon 9’s first stage has landed on the Of Course I Still Love You droneship,SpaceX,22388,1533,2791,,192
390,https://twitter.com/cb_doge/status/1749950785520099411#m,"Create on 𝕏!  If you're a Blogger, 𝕏 is the place to be.  If you're a Podcaster, 𝕏 is the place to be.  If you're a Journalist, 𝕏 is the place to be.  If you're a Writer, 𝕏 is the place to be.  If you're a Memer, 𝕏 is the place to be.  If you're an Influencer, 𝕏 is the place to be.  If you're a Photographer, 𝕏 is the place to be.  If you're an Artist, 𝕏 is the place to be.  If you're a Shitposter, 𝕏 is the place to be.  If you're a Gamer, 𝕏 is the place to be.  If you're a Video Creator, 𝕏 is the place to be.  𝕏 is the place to be when it comes to being a creator. You can make a living off it. The goal of 𝕏 is to maximize creator prosperity.",DogeDesigner,9694,2167,1710,,197
391,https://twitter.com/elonmusk/status/1749949420815405140#m,,Elon Musk,211400,16217,47039,,2792
392,https://twitter.com/cybertruck/status/1749508348935069908#m,"Cybertruck has 120V & 240V outlets on-board, plus a bi-directional charge port  Power your house, another EV, power tools or even a party off the grid",Cybertruck,19300,3313,2969,,430
393,https://twitter.com/elonmusk/status/1749617078590464322#m,Very concerning,Elon Musk,143813,12457,45002,,1492
394,https://twitter.com/elonmusk/status/1749481902782722168#m,Very important,Elon Musk,174523,13946,26242,,1045
395,https://twitter.com/stillgray/status/1749419236676751399#m,Elon Musk and Ben Shapiro are touring Auschwitz in Poland.,Ian Miles Cheong,72406,8397,6397,,1059
396,https://twitter.com/elonmusk/status/1749421844636058061#m,Important,Elon Musk,54218,7431,7415,,347
397,https://twitter.com/elonmusk/status/1749220961050652863#m,𝕏 is where news happens first,Elon Musk,99489,9290,11488,,801
398,https://twitter.com/Safety/status/1749147578674159854#m,"Today, a bug in our system caused X to incorrectly label numerous posts as Sensitive Media. We’ve fixed the underlying issue and are now working to remove labels from impacted posts.",Safety,19329,3056,4565,,1071
399,https://twitter.com/elonmusk/status/1749150144392532007#m,An 𝕏 spam/scam bot accidentally flagged many legitimate accounts today. This is being fixed.,Elon Musk,144772,15346,18358,,2701
400,https://twitter.com/TheRabbitHole84/status/1749119284524232774#m,Uncomfortable Truths > Noble Lies,The Rabbit Hole,20792,1178,3525,,194
401,https://twitter.com/elonmusk/status/1748805197629923619#m,Heavy use of Spaces,Elon Musk,52043,6619,6823,,443
402,https://twitter.com/Space_Station/status/1748695881816392095#m,The @SpaceX Dragon's hatch opened at 7:13am ET today and four #Ax3 astronauts from @Axiom_Space entered the space station meeting the Expedition 70 crew. More... https://go.nasa.gov/3vKRAoU,International Space Station,20454,1558,3130,,265
403,https://twitter.com/SpaceX/status/1748428323548758414#m,Nine Merlin engines generating more than 1.7 million pounds of thrust at liftoff,SpaceX,22229,1416,2825,,179
404,https://twitter.com/Space_Station/status/1748660723268354171#m,#Ax3 docked to the space station aboard the @SpaceX Dragon Freedom spacecraft at 5:42am ET today beginning a two-week research and education mission. https://blogs.nasa.gov/spacestation/2024/01/20/ax-3-docks-to-station-aboard-dragon-spacecraft/,International Space Station,11941,798,1646,,78
405,https://twitter.com/SpaceX/status/1748658663349444698#m,Dragon docked with the @space_station,SpaceX,27010,1538,2981,,218
406,https://twitter.com/elonmusk/status/1748598958253875709#m,"If you post interesting art, either written or visual, add it to the highlights section of your profile",Elon Musk,107923,10019,11590,,921
407,https://twitter.com/elonmusk/status/1748595664131363231#m,Don’t forget to add your best content to the Highlights section of your profile,Elon Musk,62065,6456,6094,,485
408,https://twitter.com/elonmusk/status/1748595386762039658#m,Post your music videos to 𝕏,Elon Musk,55147,7293,7911,,569
409,https://twitter.com/cb_doge/status/1748397593107878173#m,Comedy is legal on this platform!,DogeDesigner,14043,2014,1601,,148
410,https://twitter.com/elonmusk/status/1748360814115926274#m,😂,Elon Musk,315491,10684,17495,,585
411,https://twitter.com/Starlink/status/1748014780936540423#m,Starlink can provide connectivity to the most remote and rural communities around the world.  The Itaquera community in the heart of the Brazilian Amazon now has access to online educational and medical resources previously not available 🛰️🌎❤️ → stories.starlink.com,Starlink,16540,1593,2385,,194
412,https://twitter.com/SpaceX/status/1748068088506143109#m,Watch Falcon 9 launch Dragon and Ax-3 to the @space_station https://nitter.no-logs.com/i/broadcasts/1lDxLPOAZYqxm,SpaceX,16773,1328,3829,,539
413,https://twitter.com/SpaceX/status/1748069498094244054#m,"Meet Ax-3, the crew of Dragon’s 12th human spaceflight mission",SpaceX,68020,1836,6010,,729
414,https://twitter.com/elonmusk/status/1748094950779076683#m,https://nitter.no-logs.com/i/broadcasts/1YqxoDBRoEkKv?t=42m16s,Elon Musk,33198,2999,5114,,283
415,https://twitter.com/elonmusk/status/1748094375869993228#m,,Elon Musk,156840,9985,15786,,1395
416,https://twitter.com/SpaceX/status/1748091418978218142#m,"SpaceX was founded to help create a future where not just hundreds but thousands and ultimately millions of people can travel off Earth, to live and work in space and on other planets.",SpaceX,41139,1572,4419,,393
417,https://twitter.com/elonmusk/status/1748042397404037246#m,,Elon Musk,394411,16201,31748,,2612
418,https://twitter.com/elonmusk/status/1748039011237535767#m,Some posts are real bangers,Elon Musk,94904,9542,7879,,1190
419,https://twitter.com/elonmusk/status/1748036927821942798#m,So hot rn,Elon Musk,995109,57393,97934,,25564
420,https://twitter.com/elonmusk/status/1748035742075359724#m,Better version,Elon Musk,238879,8100,52194,,2221
421,https://twitter.com/elonmusk/status/1747870851138019445#m,Grok roasts Klaus Schwab at WEF,Elon Musk,114432,7604,24365,,1711
422,https://twitter.com/elonmusk/status/1747865288429682866#m,Good explanation of what makes countries more or less prosperous,Elon Musk,335152,12936,71406,,5640
423,https://twitter.com/elonmusk/status/1747800112300999125#m,Progress!,Elon Musk,120695,7256,14123,,670
424,https://twitter.com/elonmusk/status/1747792804560994770#m,"Wow, I didn’t know Elizabeth Warren was at Davos",Elon Musk,216543,22310,28362,,4984
425,https://twitter.com/Rob_2628/status/1747778466676707645#m,The @Starlink auto-heating system doing great work even in deep winter here in Germany. We have a severe weather warning in my region today for a snowstorm & still posting this on Starlink while livestreaming no problem.,Rob2628,8065,439,962,,39
426,https://twitter.com/elonmusk/status/1747414816615256292#m,You may want to follow @HelpfulNotes,Elon Musk,21816,4138,3590,,157
427,https://twitter.com/elonmusk/status/1747352736167776634#m,SpaceX is focused on making Starlink great for gaming & streaming!,Elon Musk,77640,6172,10490,,474
428,https://twitter.com/SpaceX/status/1747290740265549957#m,"Falcon 9 and Dragon vertical at pad 39A in Florida. Targeting Wednesday, January 17 for launch of Ax-3 → spacex.com/launches",SpaceX,16757,1543,2500,,182
429,https://twitter.com/elonmusk/status/1747117040018591907#m,Significant improvements have been made to @Starlink latency (ping) & many more to come.  Target is <20ms.,Elon Musk,59252,5278,5237,,392
430,https://twitter.com/farzyness/status/1747053302548668916#m,Here's an edited version of the space by @Jason with @elonmusk @BillAckman and 2024 Democratic Presidential Candidate @deanbphillips.  This version reduces time by 30% and significantly boosts audio quality.  Link to original in replies. Thanks @DavidCarbutt_ for the work!,Farzad,7794,882,1376,,132
431,https://twitter.com/elonmusk/status/1747047100502999141#m,First MrBeast video posted directly on 𝕏!,Elon Musk,298112,8665,21505,,1019
432,https://twitter.com/elonmusk/status/1747024700771860882#m,X is literally just a letter from the alphabet lmao,Elon Musk,27905,3109,2346,,314
433,https://twitter.com/elonmusk/status/1747026333652107732#m,,Elon Musk,261073,10647,15990,,1219
434,https://twitter.com/Jason/status/1747021328815894703#m,Do listen to the replay,@jason,3307,367,578,,29
435,https://twitter.com/elonmusk/status/1747023719069782067#m,Interesting discussion about colleges,Elon Musk,20193,1538,3886,,91
436,https://twitter.com/teslaownersSV/status/1747022896613204228#m,Mainstream medias source is 𝕏. The truth hurts,Tesla Owners Silicon Valley,9943,588,1369,,82
437,https://twitter.com/elonmusk/status/1747022369493749967#m,𝕏 is the future,Elon Musk,70456,5287,10342,,519
438,https://twitter.com/Starlink/status/1746988143138496623#m,"Starlink is ideal for rural locations. Later this year, @JohnDeere will begin equipping new and existing machines across the United States and Brazil with Starlink to help connect farmers with high-speed internet so they can fully leverage precision agriculture technologies 🛰️🌎❤️",Starlink,15339,1160,2458,,324
439,https://twitter.com/elonmusk/status/1746974204551999950#m,Discussion with Democratic presidential candidate @deanbphillips in 2 hours,Elon Musk,15036,2029,2077,,88
440,https://twitter.com/elonmusk/status/1746970616060580326#m,"Important note: Optimus cannot yet do this autonomously, but certainly will be able to do this fully autonomously and in an arbitrary environment (won’t require a fixed table with box that has only one shirt)",Elon Musk,18440,1824,1364,,329
441,https://twitter.com/elonmusk/status/1746965376464732639#m,,Elon Musk,287562,9845,20888,,1179
442,https://twitter.com/elonmusk/status/1746964887949934958#m,Optimus folds a shirt,Elon Musk,275747,26003,36861,,11915
443,https://twitter.com/elonmusk/status/1746958393430942137#m,To fear parody or criticism is a sign of weakness,Elon Musk,209971,14560,28773,,3250
444,https://twitter.com/tesla_na/status/1746894667826741512#m,Heat pump helps boost driving range & maximize Supercharging speeds in cold weather by using excess heat from the powertrain to warm cabin & battery  This gives our vehicles unmatched efficiency—and comes standard in every new Tesla,Tesla North America,7506,688,1049,,47
445,https://twitter.com/elonmusk/status/1746917457313353942#m,Discrimination on the basis of anything other than merit is wrong,Elon Musk,225129,13613,44789,,2287
446,https://twitter.com/elonmusk/status/1746917108649275882#m,Destroying freedom of speech means destroying democracy,Elon Musk,176693,10810,49097,,2022
447,https://twitter.com/SpaceX/status/1746731453105549637#m,Falcon 9 delivers 23 @Starlink satellites to orbit from Florida – completing our 300th successful launch!,SpaceX,18707,1406,2416,,179
448,https://twitter.com/elonmusk/status/1746789759177941209#m,Just had a conversation with some smart people could not believe this is happening  https://nypost.com/2024/01/14/news/faas-diversity-push-includes-hiring-people-with-intellectual-and-psychiatric-disabilities/amp/,Elon Musk,126062,16936,28358,,2985
449,https://twitter.com/BillAckman/status/1746666488923119818#m,"As you may have heard, four @Harvard alums would like to run for the Board of Overseers in the Spring election which begins April 1st.  Their vision: Renew Harvard's leadership, defend free speech, protect students, and fix mismanagement.    Their platform can be found here:    https://renewharvard.com/   and their bios can be found on the bottom of the Renew Harvard web page.  In order for them to be on the ballot, they need 3,200 alumni to nominate them by January 31st, which is only 17 days from now.    Please nominate them now so you don't forget. It takes fewer than five minutes even if you have to renew your password, as I did, as I had forgotten mine.    All you need is the list of candidates, their Harvard affiliation, and their date of graduation, all of which can be found below:   Nominate ALL FOUR candidates before Jan 31 using your alumni login at:  https://vote.escvote.com/harvardpetition/  Alec Williams, Harvard Business School, 2017 @alecwilliams208  Zoe Bedell, Harvard Law School, 2016  Logan Leslie, Harvard and Radcliffe College, 2015 @LoganLeslie  Julia Pollak, Harvard and Radcliffe College, 2009 @juliaonjobs  By nominating them now, you will have four additional choices to vote for at the election beginning April 1st until May 14th, 2024 at 5pm.    The other candidates for election have been chosen by the incumbent board and/or administration so only these four represent fresh blood and new perspectives.  In the election, you can decide to vote for some, all or none of them, but it is critically important to get them on the ballot so you have the option of voting for them.  I think they are all outstanding.  I have known Alec Williams, a Navy Seal still on active duty in addition to his day job as an investor for a family office, for many years.    Alec was a Princeton grad and got his JD at Yale Law School and HBS degree contemporaneously, while also doing tours of duty in Afghanistan.   The other three I met on a Zoom recently.  Their resumes speak to their excellence.  They are all best described as exceptional.  They are all military veterans and/or continue to do tours of duty in addition to their careers, which include an Assistant U.S. Attorney, an investor, an owner/operator of small businesses, and the Chief Economist of Zip Recruiter.  They were all academic superstars at Harvard as well as Yale Law School, Princeton, a Supreme Court clerk for Justice Kagan,  you get the point.  They will be doing a real campaign so you can get to know them better over the next few months before the election.  I strongly urge you to nominate them.  You can make the decision whether to vote for them once the election begins and you know more about them and their platform.  Thank you for helping save Harvard!",Bill Ackman,13762,985,2266,,151
450,https://twitter.com/elonmusk/status/1746553569010991365#m,Set new world record in Diablo AoZ last night with an excellent crew. My character is called DieHarder. https://invidious.no-logs.com/watch?si=KBA87NCCbN3qDdSX&v=rUuxHu3J1HM&feature=invidious.no-logs.com,Elon Musk,24545,3945,2883,,307
451,https://twitter.com/elonmusk/status/1746551470323839396#m,Try it!,Elon Musk,23763,3701,3085,,151
452,https://twitter.com/elonmusk/status/1746550474558386368#m,22 more Starlink 2nd generation satellites to orbit,Elon Musk,104230,5297,13124,,548
453,https://twitter.com/Tesla/status/1746179318571577722#m,The future driving the future,Tesla,28857,2478,3564,,294
454,https://twitter.com/elonmusk/status/1746336037863837967#m,,Elon Musk,31292,2670,1689,,219
455,https://twitter.com/elonmusk/status/1746331216888877147#m,Went to a monster truck rally in Austin!,Elon Musk,132464,6646,7926,,448
456,https://twitter.com/elonmusk/status/1746251228114284740#m,Earth already receives about the same energy from the Sun in an hour than humanity consumes in a year.  Solar panels just need to catch a tiny amount of it to power our entire civilization!,Elon Musk,165497,17625,24885,,1937
457,https://twitter.com/elonmusk/status/1746081231458992145#m,Highlights of the @SpaceX company talk,Elon Musk,44710,3947,6633,,262
458,https://twitter.com/elonmusk/status/1745946082150867075#m,Review of SpaceX achievements in 2023 and plans for 2024+,Elon Musk,80171,9623,13909,,629
459,https://twitter.com/lindayaX/status/1745919353412067495#m,X became the very pulse of the entire conversation @CES!,Linda Yaccarino,10105,709,1182,,47
460,https://twitter.com/elonmusk/status/1745927494488772717#m,Welcome to 𝕏!,Elon Musk,82642,6037,11770,,489
461,https://twitter.com/elonmusk/status/1745921308943069202#m,"Funny you should mention “properly-run” social networks.   Are you aware that Mark Zuckerberg, presumably a “proper-runner” of social networks, funded illegal voting vans in the last election?  https://fox59.com/news/national-world/ap-us-news/ap-wisconsin-judge-rules-that-absentee-voting-van-used-in-2022-was-illegal/amp/",Elon Musk,201276,11846,47105,,2046
462,https://twitter.com/elonmusk/status/1745919745486954944#m,Several little Easter eggs in Cybertruck,Elon Musk,90571,3066,5434,,228
463,https://twitter.com/elonmusk/status/1745917536288280715#m,"Massive increase in 𝕏 traffic in December.  So far, January is even bigger.",Elon Musk,91733,6559,10406,,623
